{
    "$schema": "http://json-schema.org/draft-07/schema#",
    "definitions": {
        "DecorationSlot": {
            "properties": {
                "level": {
                    "$ref": "#/definitions/SlotLevel"
                }
            },
            "type": "object"
        },
        "GearSkill": {
            "properties": {
                "level": {
                    "type": "number"
                },
                "name": {
                    "type": "string"
                }
            },
            "type": "object"
        },
        "GearType": {
            "enum": [
                "HEAD",
                "CHEST",
                "ARMS",
                "WAIST",
                "LEGS",
                "WEAPON"
            ],
            "type": "string"
        },
        "SlotLevel": {
            "enum": [
                1,
                2,
                3,
                4
            ],
            "type": "number"
        },
        "Stats": {
            "properties": {
                "affinity": {
                    "type": "number"
                },
                "attack": {
                    "type": "number"
                },
                "critBoost": {
                    "type": "number"
                },
                "defense": {
                    "type": "number"
                },
                "dragonResist": {
                    "type": "number"
                },
                "fireResist": {
                    "type": "number"
                },
                "iceResist": {
                    "type": "number"
                },
                "thunderResist": {
                    "type": "number"
                },
                "waterResist": {
                    "type": "number"
                }
            },
            "type": "object"
        },
        "WeaponType": {
            "enum": [
                "GREATSWORD",
                "LONG_SWORD",
                "SWORD_AND_SHIELD",
                "DUAL_BLADES",
                "HAMMER",
                "HUNTING_HORN",
                "LANCE",
                "GUNLANCE",
                "SWITCH_AXE",
                "CHARGE_BLADE",
                "INSECT_GLAIVE",
                "LIGHT_BOWGUN",
                "HEAVY_BOWGUN",
                "BOW"
            ],
            "type": "string"
        }
    },
    "properties": {
        "id": {
            "type": "number"
        },
        "name": {
            "type": "string"
        },
        "set": {
            "type": "string"
        },
        "skills": {
            "items": {
                "$ref": "#/definitions/GearSkill"
            },
            "type": "array"
        },
        "slots": {
            "items": {
                "$ref": "#/definitions/DecorationSlot"
            },
            "type": "array"
        },
        "stats": {
            "$ref": "#/definitions/Stats"
        },
        "type": {
            "$ref": "#/definitions/GearType"
        },
        "weaponType": {
            "$ref": "#/definitions/WeaponType"
        }
    },
    "type": "object"
}

